Denver Coliseum,"Located in the little red building on 13th and Marion, this cozy coffee and tea nook on the corner has beans, sandwiches and frequent live performances by an eclectic array of artists. Gypsy House is also a hookah bar."
Fillmore Auditorium,"Located in the little red building on 13th and Marion, this cozy coffee and tea nook on the corner has beans, sandwiches and frequent live performances by an eclectic array of artists. Gypsy House is also a hookah bar."
Gothic Theater,"Located in the little red building on 13th and Marion, this cozy coffee and tea nook on the corner has beans, sandwiches and frequent live performances by an eclectic array of artists. Gypsy House is also a hookah bar."
Hi-Dive,"Located in the little red building on 13th and Marion, this cozy coffee and tea nook on the corner has beans, sandwiches and frequent live performances by an eclectic array of artists. Gypsy House is also a hookah bar."
Sports Authority Field at Mile High,"Located in the little red building on 13th and Marion, this cozy coffee and tea nook on the corner has beans, sandwiches and frequent live performances by an eclectic array of artists. Gypsy House is also a hookah bar."
Larimer Lounge,"Located in the little red building on 13th and Marion, this cozy coffee and tea nook on the corner has beans, sandwiches and frequent live performances by an eclectic array of artists. Gypsy House is also a hookah bar."
Lion's Lair,"Located in the little red building on 13th and Marion, this cozy coffee and tea nook on the corner has beans, sandwiches and frequent live performances by an eclectic array of artists. Gypsy House is also a hookah bar."
Ogden Theatre,"Located in the little red building on 13th and Marion, this cozy coffee and tea nook on the corner has beans, sandwiches and frequent live performances by an eclectic array of artists. Gypsy House is also a hookah bar."
Oriental Theater,"Located in the little red building on 13th and Marion, this cozy coffee and tea nook on the corner has beans, sandwiches and frequent live performances by an eclectic array of artists. Gypsy House is also a hookah bar."
Red Rocks Amphitheater,"Located in the little red building on 13th and Marion, this cozy coffee and tea nook on the corner has beans, sandwiches and frequent live performances by an eclectic array of artists. Gypsy House is also a hookah bar."
Beta,"Located right in Downtown, Beta is one of Denver's most popular nightclubs, with a friendly clientele of all ages and sexual orientations."
Grizzly Rose,"A must for a true western experience. The Grizzly Rose is a huge saloon with line-dancing, live music, and even a mechanical bull. A popular draw for people living outside the city."
Charlie's,"Charlie's is simultaneously a gay bar and cultural landmark catering to the old west spirit and/or disco diva in all of us. Charlie's has a friendly clientele, a mix of country, pop, and dance music, and inexpensive drinks."
Tracks,"Denver's main gay nightclub, Tracks is big, friendly, and very fun. Go there Thursday for 18+ nights, or check out the monthly lesbian party First Fridays."
11th Avenue Hotel and Hostel,"Denver's main gay nightclub, Tracks is big, friendly, and very fun. Go there Thursday for 18+ nights, or check out the monthly lesbian party First Fridays."
Ramada Denver Midtown,"Denver's main gay nightclub, Tracks is big, friendly, and very fun. Go there Thursday for 18+ nights, or check out the monthly lesbian party First Fridays."
Hostel Fish,"New upscale hostel that opened in July 2015 in a historic building in downtown Denver that occupies top 2 floors of the building and a restaurant and bar on the ground floor of the historic building. The 2 story hostel has 67 dorm beds and 2 private rooms available with free continental breakfast, free wi-fi, guest lounge, bar and kitchen."
Courtyard Denver Stapleton,Between the airport and downtown Denver. 24-hour market on-site.
Crowne Plaza Denver Downtown,"Rooms are reasonably spacious and have free broadband internet access and a desk. Breakfast is modestly priced and modest in style. The lobby is typical Holiday Inn. Given the size of the hotel, reception and concierge staff numbers are small but there still seem to be no queues for their services. Stay high in a room on the Glenarm St. side if you want a mountain view. Airport shuttles ($21 to international) serve the hotel."
Embassy Suites Denver Southeast,"Near Denver Tech, hotel offers complimentary hot cooked-to-order breakfast and nightly Manager's Reception featuring complimentary cocktails and appetizers."
Magnolia Hotel Denver,"Downtown Denver hotel featuring guestrooms and suites, a restaurant and bar, and event space for meetings, weddings, and special occasions"
Sheraton Denver Downtown,"On the 16th Street Pedestrian Mall in downtown, 3 1/2 blocks from the Denver Convention Center."
SpringHill Suites Denver Downtown,Across from the Pepsi Center in LoDo.
Hyatt Place Denver Cherry Creek,Across from the Pepsi Center in LoDo.
Hyatt House Denver Tech Center,Across from the Pepsi Center in LoDo.
Hyatt Place Denver Tech Center,Across from the Pepsi Center in LoDo.
Brown Palace Hotel,"An elegant, historic hotel in downtown Denver, the Brown Palace has catered to congressmen, US presidents, and countless foreign dignitaries."
Denver Marriott City Center,A beautiful hotel in downtown Denver offering panoramic views of the Rocky Mountains and the city skyline.
Embassy Suites Downtown,"An all-suite, full service hotel."
Grand Hyatt Denver,"512 rooms with city views. Features the Hyatt Grand Bed, free 24 hour fitness facility, indoor pool, room service around the clock, well-lit work stations and high-speed internet access."
Hilton Garden Inn Denver Downtown,"Onsite restaurant, fitness center and complimentary high-speed Internet access."
Hyatt Regency Denver at Colorado Convention Center,"New thirty-seven story downtown hotel, adjacent to the Colorado Convention Center. 1,100 guest rooms, with views of the mountain and downtown."
The Oxford Hotel,The historic hotel provides a romantic retreat located in the midst of Denver’s lively LoDo district.
Westin Denver Downtown,Four-diamond hotel in downtown Denver.
16th Street Mall,Free Wifi along the pedestrian 16th Street Mall in the heart of Downtown.
Cherry Creek North,Entire area has free WiFi provided by the Cherry Creek North Business District.
Common Grounds,Common Grounds has been serving the best coffeehouse experience in Denver for over 20 years. Wireless Internet as well as a wide selection of in-house roasted coffee and coffeehouse food is available.
Peaberry Coffee,"Multiple locations. Free WiFi, but you have to ask the barrista for username and password."
Panera Bread,Free Wifi at most if not all locations.
Starbucks,free wifi at participating places
Australia,free wifi at participating places
Canada,free wifi at participating places
Denmark (Honorary),free wifi at participating places
Italy,free wifi at participating places
Mexico,free wifi at participating places
Japan,free wifi at participating places
Netherlands (Honorary),free wifi at participating places
Norway (Honorary),free wifi at participating places
Thailand,free wifi at participating places
United Kingdom,free wifi at participating places
