Metropolitan Museum of Art,"A sort of mini forest, described by its designer as a ""wild garden,"" the Ramble is sculpted out of a wooded hillside, with winding paths, rocky outcrops, secluded glades, and a tumbling stream. If one travels through the ramble when the trees are full, it is easy to lose sight of the city's skyscrapers; it's as if you're no longer in Manhattan. The Ramble is also an excellent place to bird watch, with over 250 species of birds that stop here on their migration."
The Reservoir,"Constructed between 1858 and 1862, the Reservoir is a vast urban lake that covers 106 acres of Central Park and is the largest body of water within Manhattan. Renamed the ""Jacqueline Kennedy Onassis Reservoir"" in 1994, the Reservoir is probably best known for the 1.58 mile track that runs around its edge and which is a favorite for joggers, who can both run and enjoy the spectacular views of the city skyline."
Charles A. Dana Discovery Center,"On the north shore of the Harlem Meer, the Discovery Center holds education and community programs and seasonal exhibits, as well as offering a popular place for catch-and-release fishing."
Conservatory Garden,"A six-acre garden which is Central Park's only formal garden, representing Italian, French, and English landscape styles, with formal plantings and numerous sculptures."
Great Hill,"One of the highest points in the park, the Great Hill is a hilltop meadow surrounded by stately elm trees and serves as an excellent place to picnic."
Harlem Meer,This 11 acre lake is one of Central Park's finest spots; surrounded by flowering trees and inhabited by several fish and turtle species.
North Woods,"None of Central Park is actual virgin forest, but this is the closest any part of the park gets to feeling like genuine forest. It is beautiful and cool in hot weather. However, like a real forest, it is a mosquito habitat, so make sure to use insect repellent before walking through this part of the park."
The Ravine,"One of the most idyllic and tranquil landscapes in Central Park, the Pool is an excellent spot for quiet contemplation, with its grassy banks and nearby waterfalls. A stream, The Loch flows northeast from the Pool, through a stream valley called The Ravine. A trail that follows the Loch, winding under a canopy of tall trees as the stream goes over several waterfalls and passes under a couple of stone arches."
On foot,"Central Park is a paradise for people looking to walk, hike, stroll, or jog. The entire park is friendly for hiking and strolling, with many hidden corners and a variety of terrains to explore. Speed walkers and joggers have three ideal spots in the park: the Park Drives, which circle the park and have a special lane for joggers; the Reservoir, which has a very well-used trail surrounding it; and three separate Bridle Paths, one adjacent to the Reservoir, one at the North Meadow, and one at the southern side of the park, all of which are loops that extend about 1-1.5 miles. The Central Park Conservancy operates guided walking tours year-round, which are free and require no reservation; check the website for details."
Riverdale Equestrian Centre,"The Riverdale Equestrian Centre in nearby Riverdale, New York offers guided horseback rides through Central Park, but you must already be at an advanced riding level."
Horse-drawn carriage rides,"Available year-round (except in extreme weather), a horse-drawn carriage ride is one of the most popular (and some say romantic) ways to see Central Park."
Delacorte Theater,Home to the Public Theater/New York Shakespeare Festival in the summer.
SummerStage,A popular free concert series held in the summer.
Central Park Conservancy Film Festival,"Held in mid-August, the festival shows cult classic films on an outdoor screen in Sheep Meadow."
Ancient Playground,"Inspired by the nearby Egyptian Wing of the Metropolitan Museum of Art, this playground contains several pyramid-like play structures."
Billy Johnson Playground,"A rustic-themed playground, with a stone bridge, a granite slide, a gazebo, a water feature, and playground equipment constructed of white cedar."
Heckscher Playground,"Central Park's largest playground, Heckscher is unique among Central Park's playgrounds in that it is not on the boundaries of the park. The playground has a range of play equipment, including a large water feature."
Pat Hoffman Friedman Playground,A small toddler playground with some beautifully fashioned gates adorned with sculptures of animals. In front of the gates stands Paul Manship's Group of Bears sculpture.
Safari Playground,"A jungle themed playground with hippopotamus statues, a ""canoe"" play structure, and treehouses."
Wild West Playground,"A western-themed playground with a wooded fortress-like setting, canals, sandboxes, and water sprays."
The Boathouse,"Held in the Loeb Boathouse on the Lake, the Boathouse includes a sit-down restaurant with tables overlooking the lake, a sit-down bar area outside, and an express cafe with counter service for quick takeout and eat-in food."
Le Pain Quotidien,A branch of this local chain of sit-down restaurants with organic options like handmade bread and vegan ice cream. Pre-packaged picnic boxes are also available.
Tavern on the Green,"This iconic restaurant has appeared in dozens of films as one of New York's most famous dining spots. The historic building once served as a sheep paddock before being converted to a restaurant in 1934, soon becoming a favorite destination for New Yorkers' special occasions. Although the setting is as lovely as it's always been, the restaurant itself has developed a reputation for providing overpriced food that isn't all that good."
Official NYC Information Center at Macy's Herald Square,"Multilingual FAQ stations, free WiFi, plenty of guides and maps, and the city’s only aboveground MetroCard machine."
Times Square,"A place filled with video screens, LED signs, and flashing lights; a world wonder or a tourist nightmare depending on your perspective, the ""new"" Times Square is a family-friendly theme park of themed restaurants, theaters and hotels, as well as a developing business district. The lights and signs can be viewed anytime, but the most enchanting experience comes when one visits Times Square at night, as all the signs and screens are ablaze with color. Times Square is also well known for its famous New Year's Eve ball drop. Those looking for the seedy Times Square of years past will find it around the Port Authority Bus Terminal, and on Eighth Avenue to the west."
TKTS Booth,"A ticket booth selling discounted Broadway and off-Broadway shows. However, the cheaper tickets aren't the only attraction, as the back of the booth is a large, red-lit glass staircase facing Times Square, which serves as a set of bleachers and offers an excellent opportunity to get above the street and just watch the crowds and flashing signs. Above the booth is a video screen with a live feed of the top step, giving you a chance to appear (if only briefly) on one of the many signs in Times Square."
One Times Square,"Originally the second-tallest building in the world when it opened in 1905, One Times Square was constructed to be the headquarters for The New York Times, a function it would serve for less than ten years. The annual Times Square ball drop is performed from the roof of this building. And you can't miss the famous Dow Jones news and sports zipper (the first news ticker in the world) attached to its lower facade."
Discovery Times Square Exposition,"An exhibition hall that caters to traveling exhibitions that are deemed ""too large, too expensive, too nondisciplinary or too commercial"" for local museums. Discovery TSX has been home to Harry Potter: The Exhibition, CSI: The Experience, Titanic: The Artifact Exhibition, King Tut NYC: Return of the King, and Pompeii the Exhibit."
"Intrepid Sea, Air & Space Museum","The aircraft carrier Intrepid is docked here and loaded with spacecraft and aircraft, including the very cool Blackbird spy plane and the prototype Space Shuttle Enterprise. On the other side of the dock is a guided-missile submarine and a Concorde, both of which you can tour also, and some tanks."
Madame Tussauds New York,"Get up close to over 200 lifelike wax figures of the biggest stars and icons in entertainment, sports and history."
Gulliver's Gate,very large miniature world
ABC Times Square Studios,"Come here bright and early in the morning to be in the live audience of the network's famous morning news show, Good Morning America. Walkbys can view the show in progress from the studio's street level windows and catch up on the latest news scrolling away continuously on the building's lower two message zippers."
AMC Empire 25,"This large multiplex cinema shows first-run, mainstream films on 25 screens. It also contains an IMAX cinema showing mainstream feature films."
Birdland Jazz Club,This historic club (though not at the original location of W. 52 St.) — universally acknowledged as one of the top jazz venues in the city — features a great lineup of justly famous performers and has good acoustics. Expect to pay a fair price for that quality.
Carnegie Hall,"If you ask a New Yorker how to get to Carnegie Hall, you may get the answer ""Practice, practice!"" This elegant 19th-century hall is New York's premier venue for famous recitalists and visiting symphony orchestras. The complex also includes the more intimate Weill Recital Hall slightly further east and Zankel Hall, in the basement of the side of the building facing 7th Av. near 56th St, a medium-sized venue used by jazz groups and classical concert pianists, alike."
Hudson Theatre,"This theater is over 100 years old and remains the third oldest theater on Broadway. Located right next to the Millennium Broadway Hotel, it remained defunct as a theater for decades, acting as the hotel's event space. It is now slated to reopen in February 2017."
Kramer's Reality Tour,"For Seinfeld fans. Kenny Kramer, said to be the inspiration for the character Kramer, tells about the show, in a fun way. And guides on a tour to places seen in the show. Stop for photo outside the restaurant seen in the show."
Wicked the Musical,"An incredibly popular show which has been on Broadway for roughly ten years, Wicked is one of the highest rated shows that has ever hit Broadway. It's based on the Wizard of Oz, but told from the witch's point of view instead of Dorothy's. The show runs about 2 hours and 45 minutes."
The Lion King,"The highest grossing stage production of all time, this musical based on the 1994 Disney animated film has won numerous awards and has been going strong since its premiere in 1997. This show runs about 2 hours and 40 minutes."
Broadway Comedy Club,"This is one of the most respected comedy clubs in all of New York City, one that has played host to the likes of Joe Devito, Scott McFadden, Jimmy Fallon, David Letterman, and many others who have gone on to make it big in television. Tickets generally run for about $20 a night, and include a free pitcher of beer. Shows run up until as late as 11PM and are a great way for you to end your evening."
B.B. King Blues Club & Grill,"A phenomenal place with one of the widest varieties of music in town, featuring cover bands and soul tributes which fill the gaps between big-name bookings such as Chuck Berry and Solomon Burke. Lately, the club has also shown an interest in extreme-metal bands such as Obituary and Dark Funeral and hip-hop acts such as the Lox and Kool Keith. For many shows, the best seats are at the dinner tables up front, but the menu prices can get pretty expensive and the food is not very good - best to stick to unmixed drinks and have only the simplest food, if necessary. On Sundays, B.B.’s has the Harlem Gospel Choir come in and has a buffet brunch."
NIT,"One of the world's most famous and busiest arenas, Madison Square Garden is home to the New York Rangers NHL team, the New York Knicks NBA team, the New York Liberty WNBA team, and the St. John's Red Storm college men's basketball team, as well as numerous concerts and entertainment events. In addition to most St. John's home games, the Garden also hosts three major college men's basketball events each year. At the start of the season, the Garden hosts the semifinals and finals of the NIT Season Tip-Off, a prestigious early-season event operated by the country's main college sports body, the NCAA. After the regular season, the Garden then hosts the Big East Conference Men's Basketball Tournament in early March, which determines the conference's automatic representative in the wildly popular NCAA tournament. Finally, in late March, the Garden hosts the semifinals and finals of the National Invitation Tournament (NIT), a tournament that the NCAA operates as something of a consolation prize for teams that do not make the NCAA tournament."
B&H,"Perhaps the best camera and photography equipment store in New York, this is the place to go for any of the cameras and camera accessories you might want. The selection is good and the staff is knowledgeable and willing to discuss things with you. It is owned and heavily staffed by Hasidic Jews, so it is closed on Friday nights, Saturdays, and all Jewish holidays except for Hanukkah. B&H provides its holiday closing schedule here."
Hershey's Times Square,"You are able to purchase all types of chocolate goodies and Hershey-themed products at this store. A few dollars can also get you a personalized message scrolled across their zipper outside on the store's facade. Hershey stores are all over the country but this particular store is the largest Hershey's store in the world. It has three floors of pure chocolate, and Hershey's products."
Macy's,"Billing itself as ""The World's Largest Store"" on the large signs outside, this is the flagship store of the national chain and covers an entire city block. Its holiday window displays are so popular that they usually have a corporate sponsor. One useful tip for visitors is to go to the Macy's guest center on floor 1 1/2 and they will give you a guest card that discounts virtually everything in the store by 11%."
Kinokuniya Bookstore,"A Japanese book dealer, carrying a huge selection of Japanese reading material. It also sells a number of books by Japanese authors in English translation. It is also known as a source of excellent Japanese anime and manga, much of which is difficult or impossible to find anywhere else in the United States."
M&M's World New York,You can purchase all types of M&M goodies and M&M-themed trinkets here.
Midtown Comics,"An absolutely gigantic comic book store, one of the largest and most well-known in the country, with two full floors of comics, collectibles, manga, and back issues, as well as a very knowledgeable staff. Signings by giants in the comic book industry are a regular occurrence here and the store also sponsors the annual New York Comic Con held every October. Smaller locations can be found in Midtown East and the Financial District."
Sephora,One-stop shopping for cosmetics.
Cranberry Cafe,"A huge variety of sandwiches, pizza, sushi, and udon. Hot and cold salad bars. Sandwiches are $4-$6. Very popular with local workers, so it gets very busy at breakfast and lunch time. There is ample seating upstairs."
Poseidon Bakery,"Serves wonderful Greek pastries, savory and sweet alike. There is no place to sit, but the staff are very friendly and helpful, and you can have a delicious, cheap meal for takeout."
The Halal Guys,"An extremely popular and affordable food stand that is probably the only Mediterranean stand in all of Manhattan that was actually given a name. This is the original location and since it started in 2008, it has begun a chain and opened 5 more throughout Manhattan and Bergen County, NJ. Delicious gyros, wraps, and falafel, and each dish comes with rice and pita bread. There's also an incredible white sauce that's worth trying. Note that if you want some on a weekend, you're going to have to get there early because there is guaranteed to be a long wait."
The Original Soup Man,"Inspiration for the Soup Nazi from ""Seinfeld"". Menu items change daily. The best soup in the area, but ONLY if you follow the rules! ""NO SOUP FOR YOU!"""
Ariana Afghan Kabob,"Very good food, which of course includes kebabs, but also peppery Aush (a type of beany noodle soup), Badinjan Burani (a fried eggplant appetizer garlic and yogurt, served with bread), etc. Salads, which come with main dishes, have a dressing which includes mayonnaise. Ask for no dressing and put the green hot sauce on them yourself."
Dos Caminos,"Dos Caminos' fifth New York City location. Designed by Brooklyn-based company, hOmE, spanning two floors, and featuring a 40-seat mezcal and margarita bar on the street level and a guacamole bar on the subterranean level. Expanded menu of Chef Ivy Stark’s healthy Mexican dishes as well as a selection of 120 premium tequilas."
Gazala Place,"Dependably delicious Israeli Druze cuisine. Their babaganush is categorically better than at most other places, with great smokiness. Their special meze platter, which is not on the menu but seems to always be available, is a fair deal at $20-something. The restaurant is a bit cramped, especially when you have to walk through the kitchen to the restroom, but for food this good at these kinds of prices this close to Times Square and helpful service, it's really worthwhile."
John's Pizzeria,"A popular pizza option with a lovely and spacious atmosphere and brick oven, coal fired, thin crust pizzas. Whole pies, no slices. Many fans, however, observe that the pizza at this location is not nearly as good as at their original Greenwich Village location. Also, pre-theater, it can be absolutely mobbed, with wait times of an hour or more."
Ocha Sushi,Japanese restaurant with good sushi.
Vice Versa,"Simple, but tasty Italian fare."
Westway Diner,"Real New York diner, excellent place for good value breakfast. Very good service."
Wondee Siam,"Small restaurant, so expect to wait on line at peak hours (e.g., Friday and Saturday nights); generally considered to be one of the best Thai restaurants in Manhattan. Food ranges in spiciness from mild to very spicy, not always consistent with what you ask for, but staff are happy to provide extra dried red pepper flakes on the side. Consistently tasty food, especially if you stick with the items on the ""secret Thai"" menu card on the table and ask for everything to be ""very spicy and Thai style, not sweet."""
Abigael's On Broadway,"Kosher. The main restaurant is downstairs, where the quiet atmosphere is a nice break from the vibrancy of the area. Service can be slow, but it's great for a long, relaxed dinner to end off an exciting day."
Aureole,"Kosher. The main restaurant is downstairs, where the quiet atmosphere is a nice break from the vibrancy of the area. Service can be slow, but it's great for a long, relaxed dinner to end off an exciting day."
Barbetta,"Kosher. The main restaurant is downstairs, where the quiet atmosphere is a nice break from the vibrancy of the area. Service can be slow, but it's great for a long, relaxed dinner to end off an exciting day."
Blue Fin,"Sushi bar, bar and lounge area, communal table and expanded private dining room options."
Brasserie 1605,"Sushi bar, bar and lounge area, communal table and expanded private dining room options."
Ruby Foo's,"Pan-Asian Restaurant combines Chinese, Thai, & Japanese food."
The Irish Pub,Great place to drink after a long day at work.
McGee's Restaurant and Pub,"This is an unpretentious pub in the middle of a pricey neighborhood. The prices are very inexpensive for the neighborhood, and the pub also provides downright good food. Service is pleasant and helpful."
The Perfect Pint,"Two-story pub off of Times Square with good Irish beers on tap and pricey entrées. Definitely not typical pub-grub, but the price matches."
Hotel Carter,Offering 700 lodging accommodations all with private bath. Close-up view of the ball drop at New Times Square.
Hotel Pennsylvania,"Large hotel, landmark, near all the action in the area. Once a luxury hotel built by the Pennsylvania Railroad at the time of its opening in 1919, it has sadly fallen upon hard times since the collapse of the railway company, and these days functions as a budget hotel. As low as $99/night. Restaurants, café, fitness centre, meeting facilities for 10 to 1000. Pet friendly. There is a $4 charge for each piece of luggage stored and be warned, cleanliness is not a high point."
New York Inn,"Affordable lodging accommodations offering double standard bed, color cable TV, telephone, AC/heating and private facilities. Refrigerators, ironing and ironing boards are available upon request. Safety box is available at no extra charge. Free wifi plus one internet kiosk are available in the lobby."
Casablanca Hotel,Boutique hotel just off Times Square. High-speed Wi-fi and complimentary refreshments in Rick's Cafe 24 hours a day including breakfast in the mornings and wine and cheese receptions in the evenings except for Sunday nights.
Courtyard New York Manhattan/Times Square,Boutique hotel just off Times Square. High-speed Wi-fi and complimentary refreshments in Rick's Cafe 24 hours a day including breakfast in the mornings and wine and cheese receptions in the evenings except for Sunday nights.
Hilton Garden Inn,"Completely remodeled in 2005 with flat-screen TVs, comfy bedding. Free wireless, business center and in-room fridge."
Hotel Mela,Luxury boutique hotel in Times Square.
36 Hudson Hotel,Luxury boutique hotel in Times Square.
Salisbury Hotel,King and double-bed rooms. Standard rooms are much larger than typical as the hotel was originally designed as a suite hotel.
Sanctuary Hotel,A Times Square-area hotel offering modern accommodations.
Travel Inn Hotel,A Times Square-area hotel offering modern accommodations.
Belvedere Hotel,Art Deco hotel.
Crowne Plaza Times Square,"Upscale hotel with 770 guest rooms, Manhattan's largest indoor lap pool, Brasserie 1605 Restaurant, meeting facilities."
DoubleTree Suites Times Square,Actual suites with a reasonable amount of space for NYC. Free cookies at the front desk.
Hilton New York Midtown,"A massive, amenity-laden hotel tower."
Hotel Edison,"Art Deco hotel built in 1931, steps from Times Square, known for its mock-Art Deco murals on the ground floor."
Homewood Suites by Hilton Midtown Manhattan,"Extended stay NYC hotel. Complimentary Wi-Fi and wired Internet access. Free hot full breakfast each morning and evening dinner and drinks, Monday through Thursday."
Hudson Hotel,"A fashionably trendy upmarket boutique hotel which is great for celeb spotting. Rooms are comparatively tiny with little storage space, so think again if you travel with a big wardrobe. Otherwise, the subdued lighting, designer fittings, and relatively lower prices tend to attract a younger vibey crowd, especially to the über-trendy bar at the foyer level."
InterContinental New York Times Square,"A fashionably trendy upmarket boutique hotel which is great for celeb spotting. Rooms are comparatively tiny with little storage space, so think again if you travel with a big wardrobe. Otherwise, the subdued lighting, designer fittings, and relatively lower prices tend to attract a younger vibey crowd, especially to the über-trendy bar at the foyer level."
JW Marriott Essex House,"A fashionably trendy upmarket boutique hotel which is great for celeb spotting. Rooms are comparatively tiny with little storage space, so think again if you travel with a big wardrobe. Otherwise, the subdued lighting, designer fittings, and relatively lower prices tend to attract a younger vibey crowd, especially to the über-trendy bar at the foyer level."
The London NYC,"A fashionably trendy upmarket boutique hotel which is great for celeb spotting. Rooms are comparatively tiny with little storage space, so think again if you travel with a big wardrobe. Otherwise, the subdued lighting, designer fittings, and relatively lower prices tend to attract a younger vibey crowd, especially to the über-trendy bar at the foyer level."
Manhattan Club,"Suites and first class services and amenities. Each suite features appliances, plush fabrics and elegant furnishings with marble baths. Timeshares available."
The Millennium Broadway Hotel New York,"Hotel near Broadway that features spacious rooms and suites, a conference center, wedding reception locations, event venues and an on-site restaurant."
New York Marriott Marquis Times Square,"Gigantic in size with updated hotel rooms, high-speed elevators and six hotel restaurants and lounges. It is known for its revolving bar and the view from its clear-sided elevators."
Park Central Hotel,"Right next to Carnegie Hall and close to the Theater District. Recently spent $65 million on renovations. While its renovations have significantly improved this hotel, it is, at best, a four-star hotel and clearly not one of New York's luxury hotels."
Renaissance New York Hotel Times Square,"Right next to Carnegie Hall and close to the Theater District. Recently spent $65 million on renovations. While its renovations have significantly improved this hotel, it is, at best, a four-star hotel and clearly not one of New York's luxury hotels."
Staybridge Suites Times Square,An extended stay hotel offering pet friendly lodging accommodations and suites with fully equipped kitchens.
West 57th Street by Hilton Club,"Studios, one- and two- bedrooms suites with floor to ceiling views of New York City."
Westin New York at Times Square,"Studios, one- and two- bedrooms suites with floor to ceiling views of New York City."
NYC Information Center–City Hall,"Guides, maps, pamphlets, brochures, and bilingual staff available for questions."
NYC Information Center–South Street Seaport,"Guides, maps, pamphlets, brochures, and bilingual staff available for questions."
