Fu Run,"Fairly cheap place to try Chinese Muslim food, particularly from the Northeast. They have all the standard offerings (including, somewhat surprisingly, a large pork selection), but the standout is the lamb dishes. Try lamb's kidney if you're adventurous."
Sushi Village,"Asian restaurant which makes a little pricey sushi and other Asian goods, but all keeps it nice. Service is kinda slow. Think the restaurant's full? Think again! This restaurant has a tiny staircase that brings you down to the basement, where the service is obviously slower. Those are the good and bad about Sushi Village. Try the Kamikaze Roll if you want a hint of spice!"
Bagel Oasis,"Often regarded as the best bagels in Queens, with an excellent variety of cream cheese spreads and sandwiches available. However, the location is a little far from anything of tourist interest."
The Sandwich Bar,"If you like ""make your own"", this is your place. Choose from seven types of schnitzel (or any of the other entrees or salads); then select sauces and toppings to your taste. Order something different every time; it won't get boring. Kosher."
Sheraton LaGuardia East Hotel,"If you like ""make your own"", this is your place. Choose from seven types of schnitzel (or any of the other entrees or salads); then select sauces and toppings to your taste. Order something different every time; it won't get boring. Kosher."
Comfort Inn,"If you like ""make your own"", this is your place. Choose from seven types of schnitzel (or any of the other entrees or salads); then select sauces and toppings to your taste. Order something different every time; it won't get boring. Kosher."
Best Western Queens Court Hotel,"If you like ""make your own"", this is your place. Choose from seven types of schnitzel (or any of the other entrees or salads); then select sauces and toppings to your taste. Order something different every time; it won't get boring. Kosher."
Red Roof Inn Flushing New York - LaGuardia Airport,"If you like ""make your own"", this is your place. Choose from seven types of schnitzel (or any of the other entrees or salads); then select sauces and toppings to your taste. Order something different every time; it won't get boring. Kosher."
Flushing YMCA,"If you like ""make your own"", this is your place. Choose from seven types of schnitzel (or any of the other entrees or salads); then select sauces and toppings to your taste. Order something different every time; it won't get boring. Kosher."
Marco LaGuardia Hotel,"Upscale boutique hotel, clean, free Wi-Fi."
Bronx Zoo,"A world-class zoo featuring over 6000 animals. As with any big city, there are occasional break-ins, so be careful with your car and stow or carry valuables with you to help avoid this possibility."
New York Botanical Garden,48 magnificent gardens and plant collections on a 250-acre historic site.
Wave Hill,Public garden and cultural center overlooking the Hudson River.
Orchard Beach,"""The Bronx Riviera"". 1.1 miles (1.7km) of artificial beach created in the 1930s. Located in Pelham Bay Park at the western end of Long Island Sound. The Bx5 and Bx12 serve it during the summer."
City Island,Has a good nightlife and is served by the Bx29 from the Pelham Bay Park subway station.
Edgar Allan Poe Cottage,"The small wooden farmhouse, built about 1812, once offered unobstructed views of the rolling Bronx hills, perhaps even to the shores of Long Island. It was Poe's home from 1846 to 1849, the last three years of his life. He wrote some of his most famous works, including ""Annabel Lee"" and ""The Bells."" Administered by the Bronx County Historical Society since 1975, the cottage is restored to its original appearance, with authentic period furnishings. There's a film presentation and guided tour."
Woodlawn Cemetery,"This 400-acre (160-ha) cemetery opened in 1863 and is one of the largest cemeteries in the city. The final resting place of over 300,000, some of its more famous residents included Joseph Pulitzer, Herman Melville, David Farragut, Duke Ellington, and Frank Woolworth. Call for tour times, and a permit is required for photography."
Maritime Industry Museum at Fort Schuyler,"The main exhibit area encompasses the history of seafaring from the ancient Phoenicians to present day steamship and passenger ship lines. Exhibitions include paintings, models, tools and navigational instruments documenting progress from the earliest sailing vessels to modern technology. Lovely waterfront location too."
Bronx Museum of the Arts,"The museum highlights contemporary urban art, and focuses on different dynamic local artists."
Valentine-Varian House (Museum of Bronx History),It’s the last farmhouse in the Bronx from the mid-1700s. Exhibitions and public educational programs focus on the borough’s history.
Hall of Fame for Great Americans,"Called the ""original"" Hall of Fame in the United States, this Hall of Fame, founded in 1900, honors Americans who significantly impacted the country's history. The site is home to about 100 bronze busts of its inductees, and is now a part of Bronx Community College."
Bartow-Pell Mansion Museum,"Depicts the Pelham Bay Park as it once was centuries ago. The house is one of the only country estates left, and is now surrounded by urban scenery."
Monument Park,"Home of the New York Yankees baseball and New York City FC soccer team. The old Yankee Stadium, ""The House That Ruth Built"", is no longer in use, and has been replaced by the new Yankee Stadium across the street. The site of the old stadium is now Heritage Park, a large baseball and softball field that has a few nods to the old ballpark, like markers in the sidewalk paying tribute to the history of the old stadium and a section of the frieze from the old park. The current stadium has strict security policies, and as such backpacks and camcorders are not allowed inside (only bags under 14"" permitted). Monument Park behind center field pays homage to the great, Yankee legends of baseball; it officially closes 45 minutes before game time, but is oftentimes closed sooner if the crowds are large enough. If visiting Monument Park is a priority, best bet is to arrive close to when the gates open."
Bronx Historic Districts,"Almost all the historic districts of the Bronx are South of Fordham Rd. Check out the website address for a complete listing. Some highlights are the Bertine Block, the Mott Haven brownstones found along Alexander Ave and just east of Willis Ave on 139th-141st Sts., and the Longwood Historic District."
City Island,"An island in the Long Island Sound, part of Bronx County but with the feel of a New England fishing/boating village; you wouldn't believe you were still within the city limits of New York. The restaurants there are not noteworthy, but the atmosphere is."
Sunday Market,This is a great place for gathering and shopping for the best quality and fresh grown products in the area.
Bronx Culture Trolley,"Meet the first Wednesday of each month (except Sept and Jan) at Hostos Community College, this is a free tour of the most entertaining and delightful spots in the whole region. This includes when music festivals and street fairs are in progress."
Tour De Bronx,"Usually in late October, it's New York State's largest free bicycling event."
Riverdale Festival of the Arts,"In late October, W 256th St (between Delafield and Mosholu Aves). This day is dedicated to all sorts of live music from jazz to rock and will have street merchants and foods."
Bronx Week Parade,"In late May, marching up Mosholu Parkway, this give all Bronxites the opportunity to show their pride and at the parade it has marching bands, schools, student groups, sports teams and much more."
Crotona Park,This park contains the largest and deepest public swimming pool in New York City.
Pelham Bay Park,"The largest park in New York City (3 times the size of Central Park) offers numerous activities, including 13 miles (20km) of shoreline with swimming at Orchard Beach, horse trails, bike paths, tennis courts, playgrounds, and picnic areas."
Van Cortlandt House,"It is the fourth largest park in New York City and home of America's oldest golf course. The Van Cortlandt House is the Bronx's oldest building. The largest freshwater lake in all of NYC is in the park. It also has numerous sports fields and ball courts, children's playgrounds, running tracks, and the Riverdale Equestrian Center. During the summer time you’ll find the locals barbecuing and throwing parties in the park."
Hunts Point Farmers Market,"It is the fourth largest park in New York City and home of America's oldest golf course. The Van Cortlandt House is the Bronx's oldest building. The largest freshwater lake in all of NYC is in the park. It also has numerous sports fields and ball courts, children's playgrounds, running tracks, and the Riverdale Equestrian Center. During the summer time you’ll find the locals barbecuing and throwing parties in the park."
New York Botanical Garden Farmers Market,"It is the fourth largest park in New York City and home of America's oldest golf course. The Van Cortlandt House is the Bronx's oldest building. The largest freshwater lake in all of NYC is in the park. It also has numerous sports fields and ball courts, children's playgrounds, running tracks, and the Riverdale Equestrian Center. During the summer time you’ll find the locals barbecuing and throwing parties in the park."
Garden Gourmet,"The best place in the Bronx for fresh produce, and is a neighborhood diamond in the rough. They have a diverse selection of cheeses and fresh bread loaves. Homemade dips, salsas, hummus, sushi, and other hot prepared ethnic foods and soups. Organic food for extremely cheap."
Mamma Rosa's Cucina & Salumeria,"One of the best delis in the Bronx area. Mamma Rosa knows how to bring Italian culture to the neighborhood. They give generous amount of meats on their sandwiches. Their special pasta sauces are always fresh and delicious, and different ones are made daily."
The Candy Box & Gelato Shoppe,"This cutely decorated shop has various items like candy, dried fruit, nuts, sorbet, gelato, and frozen yogurt. The store hosts birthday parties and other special occasions. Plus the entire store is Kosher certified."
3 Floors Department Store,"They have a range of different items, like clothes, home goods, watches and perfumes. The basement has designer shoes for as low as $5. That's including everything from sandals in the summer to boots in the winter."
Webster's Close Out Center,Everything in the store is extremely inexpensive. They have racks of discounted clothing and bins of decor waiting outside for people to start rummaging through.
Bay Plaza,"One of the biggest shopping centers in the area, including over 45 stores and 9 anchor stores. They have a handful of restaurants, jewelry stores, electronics and a movie theater."
Fordham Road Center,"This is the place to get trend-setting products for discount prices. Fordham Road extends for over a mile with shops door-to-door. It has it all from cheap furniture to sneakers. Right next to Fordham University, and in the center of the birth of hip-hop, this is an upbeat area with lots to offer."
The Hub,"This area is one of the older shopping centers in the Bronx. Street stands pack the sidewalks with discounted products to purchase. This is where bargaining skills would be encouraged and practiced. Music fills the air from the booming record stores that offer a wide selection of hip-hop, and Latin genres."
Frank Bee,"Frank Bee's is one of the oldest costume shops in the New York area. Its old-fashioned look give an authentic and vibrant feel. They sell costumes for all ages, all occasions, with many selections to choose from. Their merchandise is quality-made with fair prices."
Citygirl Accessories,"This store has unique gifts at discounted prices. Some of their sterling silver items can be as little as $10. The store has Mexican and Midwestern style art that is always up for purchase. They sell earrings, bracelets, necklaces, pendants, hair accessories, headbands, figurines, pill boxes, knitwear, scarves, etc."
The Rambling House,Serving the best Irish food in the Bronx.
Mo Gridder's,"The best BBQ joint in the Bronx. Unfortunately, it is only open for lunch. Although it's outdoors, there is a dining area in the waiting area of an auto repair shop next door."
Artie's,"A good steak, seafood, and pasta place. Reasonable prices."
Lollipops Gelato,"Offers 36 flavors of fine gelato, many with Caribbean flavors. Free street parking and a parking lot next door. There's seating inside and out under a tiki umbrella. Very much an island feel. Extensive free tasting with guidance from the friendly staff to help you choose."
El Molcajete Mexican Restaurant,Good chorizo. Plenty of vegetarian options.
Starving Artist Cafe & Gallery,"Local artists and crafters sell their unique work here, and musicians and bands play live music at nighttime. This coffeehouse makes excellent fresh cappuccino."
Days Inn Hotel: Yankee Stadium / Bronx,"Local artists and crafters sell their unique work here, and musicians and bands play live music at nighttime. This coffeehouse makes excellent fresh cappuccino."
Howard Johnson Bronx NY,"One of the cheaper places to stay in the New York metro while having easy access to the city.  However, there's some questionable activity outside the main doors, noise is not regulated and the ""continental breakfast"" leaves much to be desired."
Best Western Bronx Inn,"One of the cheaper places to stay in the New York metro while having easy access to the city.  However, there's some questionable activity outside the main doors, noise is not regulated and the ""continental breakfast"" leaves much to be desired."
Ramada,"One of the cheaper places to stay in the New York metro while having easy access to the city.  However, there's some questionable activity outside the main doors, noise is not regulated and the ""continental breakfast"" leaves much to be desired."
Allerton Branch,"One of the cheaper places to stay in the New York metro while having easy access to the city.  However, there's some questionable activity outside the main doors, noise is not regulated and the ""continental breakfast"" leaves much to be desired."
Baychester Branch,"One of the cheaper places to stay in the New York metro while having easy access to the city.  However, there's some questionable activity outside the main doors, noise is not regulated and the ""continental breakfast"" leaves much to be desired."
Belmont Branch,"One of the cheaper places to stay in the New York metro while having easy access to the city.  However, there's some questionable activity outside the main doors, noise is not regulated and the ""continental breakfast"" leaves much to be desired."
Bronx Library Center,"The main Bronx branch. As such, it is one of the only ones open early in the morning, late at night, and on Sundays."
Castle Hill Branch,"The main Bronx branch. As such, it is one of the only ones open early in the morning, late at night, and on Sundays."
City Island Branch,"The main Bronx branch. As such, it is one of the only ones open early in the morning, late at night, and on Sundays."
Clason's Point Branch,"The main Bronx branch. As such, it is one of the only ones open early in the morning, late at night, and on Sundays."
Eastchester Branch,"The main Bronx branch. As such, it is one of the only ones open early in the morning, late at night, and on Sundays."
Edenwald Branch,"The main Bronx branch. As such, it is one of the only ones open early in the morning, late at night, and on Sundays."
Francis Martin Branch,"The main Bronx branch. As such, it is one of the only ones open early in the morning, late at night, and on Sundays."
Grand Concourse Branch,Only partially wheelchair-accessible.
High Bridge Branch,Only partially wheelchair-accessible.
Hunt's Point Branch,Only partially wheelchair-accessible.
Jerome Park Branch,Only partially wheelchair-accessible.
Kingsbridge Branch,Only partially wheelchair-accessible.
Melrose Branch,Not wheelchair-accessible.
Morris Park Branch,Not wheelchair-accessible.
Morrisania Branch,Not wheelchair-accessible.
Mosholu Branch,Not wheelchair-accessible.
Mott Haven Branch,Not wheelchair-accessible.
Parkchester Branch,Not wheelchair-accessible.
Pelham Bay Branch,Not wheelchair-accessible.
Riverdale Branch,Not wheelchair-accessible.
Sedgwick Branch,Not wheelchair-accessible.
Soundview Branch,Only partially wheelchair-accessible.
Spuyten Duyvil Branch,Only partially wheelchair-accessible.
Throg's Neck Branch,Only partially wheelchair-accessible.
Tremont Branch,Only partially wheelchair-accessible.
Van Cortlandt Branch,Only partially wheelchair-accessible.
Van Nest Branch,Only partially wheelchair-accessible.
Wakefield Branch,Only partially wheelchair-accessible.
West Farms Branch,Only partially wheelchair-accessible.
Westchester Square Branch,Not wheelchair-accessible.
Woodlawn Heights Branch,Not wheelchair-accessible.
Woodstock Branch,Not wheelchair-accessible.
Amundsen Circle,"A small park that is not much more than a clearing and some trees. A monument to the man the park was named for, Roald Amundsen, stands in the center of it."
Blue Heron Park,"A large park on the South Shore known from its large collection of wildlife, from birds to wildflowers. True to its name, the park is a known habitat for blue herons."
Clawson Playground,"This deceivingly small park has two large asphalt playgrounds, two smaller ones, a grass field, a baseball field, basketball courts, and a jungle gym. It is always peaceful and rarely crowded, as it is shared by Public School 50 during school hours."
Schmul Park,"Only in the first stages of development, this mega-park is set to be 2,200 acres—three times the size of Central Park. It will cover the wild areas of the Fresh Kills, as well as what was formerly the Fresh Kills Dump. The first section of the park, Schmul Park, in Travis, features a large and colorful playground for kids, along with basketball courts, handball courts, and an open grass field."
Fort Wadsworth,"Dating back to 1663, this fort was used during both the American Revolution and the War of 1812. It remained active until 1995. It is now semi-active, with its main use being local headquarters for the United States Coast Guard. Tours are available."
Miller Field,"This park was operated as a United States Army airfield from 1919-1969. Now, it is a large, mostly grass park with baseball fields, soccer fields, and a children's playground."
A small portion of the beach is currently closed for radiation screenings.,This park is home to a large woodland and a number of beaches. A small portion of the beach is currently closed for radiation screenings.
Greenbelt Nature Center,"A humongous collection of woodlands and parks (2,800 acres!), the Greenbelt is a collection of nature you wouldn't expect to see in any major city, let alone New York. The Greenbelt covers much of the Mid-Island, so it's best to know which part you want to go to beforehand. A good place to start is the Greenbelt Nature Center an educational facility located in the center of the park. The park is a great place for hikers, and a map of hiking trails can be found here"
Lemon Creek Park,"This park is home to the creek that shares its name, as well as a variety of wildlife. One of the most notable is the purple martin. The park has one of the very few colonies in the New York Metro."
South Beach & Boardwalk,"This beach is a pleasant place to relax. The water is safe enough to swim in, but it's not the best you can get (you'd get a better deal down the Jersey Shore or on Long Island). The boardwalk, one of the longest in the United States, is great for running or biking."
Von Briesen Park,"The former estate of Arthur Von Briesen is now a small, hilly park."
Willowbrook Park,A large park with a carousel.
Wolfe's Pond Park,A large park with a carousel.
Alice Austen House,A large park with a carousel.
Conference House,"Dates back to 1680, and held an abortive peace conference during the Revolutionary War."
Historic Richmond Town,"Dates back to 1680, and held an abortive peace conference during the Revolutionary War."
Jacques Marchais Museum of Tibetan Art,"American woman Jacques Marchais had a dream of traveling to Tibet. While she never made it, her extensive collection of Tibetan artifacts was made into a museum in 1947. The museum now holds over 120 pieces of beautiful Tibetan art. The museum's authenticity was praised by the Dalai Lama himself."
Staten Island Children's Museum,"American woman Jacques Marchais had a dream of traveling to Tibet. While she never made it, her extensive collection of Tibetan artifacts was made into a museum in 1947. The museum now holds over 120 pieces of beautiful Tibetan art. The museum's authenticity was praised by the Dalai Lama himself."
Postcards,Staten Island's September 11th memorial honors all of its residents that lost their lives on 9/11/2001.
Snug Harbor Cultural Center,"By taking the S40 or S44 buses from the ferry (bus ramp D). This is the largest collection of Greek revival, temple style buildings in America. A true architectural gem featuring the Staten Island Botanic Garden, which features an authentic Chinese Scholar's garden (created by actual Chinese scholars!). There is also an art museum, the John A. Noble Collection, on the grounds. This is one of the most beautiful places in New York, a place even the most jaded New Yorker will marvel at."
Richmond County Bank Ballpark,"Go to a game of this A-class Minor League Baseball team, an affiliate of the New York Yankees. Come for a relaxed, fun time, away from the smothering hustle and bustle of the major leagues."
Staten Island Zoo,"Located in West New Brighton, it's a fun destination for younger children as well as animal enthusiasts. The zoo formerly had the highest number of snake species of any zoo in the world. It no longer holds that title, but still has a substantial reptile wing."
Staten Island Local History,"Come and visit one of the largest public library collections in the world. Just sit down with one of the millions of good books and relax. You can also use a computer or take books outside of the library, although you first must register for one of the library's famous red and blue cards. For the history buff in you, every Staten Island branch has a file cabinet marked Staten Island Local History with fascinating documents relating to Staten Island's history. A list of Staten Island locations can be found below."
United Artists Theater,The biggest movie theater on the island is a great place to relax and watch a flick.
Atrium Stadium Theaters,"Another large movie theater, the Atrium is also great for taking in a movie."
Staten Island Mall,"The Staten Island Mall is the largest mall in New York City and the center of retail life in Staten Island. There are three anchor stores: Macy's, JCPenney, and Sears. There is also a large food court and a variety of smaller stores. In the vicinity, there are a number of sizable shopping centers."
Bricktown Mall,"Taking up 400,000 square feet, this mall houses a small number of large stores."
Hylan Plaza,"A smaller shopping center, Hylan Plaza is still home to a number of retail stores alongside numerous mom-and-pop shops. It's located along a line of smaller shopping centers."
Saint George Greenmarket,"A smaller shopping center, Hylan Plaza is still home to a number of retail stores alongside numerous mom-and-pop shops. It's located along a line of smaller shopping centers."
Staten Island Mall Greenmarket,"A smaller shopping center, Hylan Plaza is still home to a number of retail stores alongside numerous mom-and-pop shops. It's located along a line of smaller shopping centers."
Heritage Farm,This market sells products only grown on-site.
120 Bay Cafe,Laid back eatery. Cool decor. Excellent appetizers and burgers. Great beers on tap. Entertainment weekly!
Denino's Pizzeria & Tavern,Arguably the best pizza on Staten Island.  It is reasonably priced and has tasty dishes besides pizza.
Gennaro's,"While it is overshadowed by the hordes of fancier pizza parlors on the island, Gennaro's is perfect if you're looking for a cheap slice the whole family can enjoy."
Goodfella's,"Famous for their vodka pizza, the recipient of several awards."
Joe And Pat's,"Specializes in an extraordinarily thin pizza that is one of the best slices in the city. Uniquely thin without too much cheese, Joe and Pat's slices are some of the lightest in the city. Try the eggplant fries."
Pizzeria Giove,"A small pizzeria known for its authentically Italian thin crust pizza. Unlike New York pizza, it is cooked in a wood-fired oven. It has been featured on the TV show Throwdown with Bobby Flay."
Ralph's Itailan Ices,"The original store of the successful chain of stores serving light, refreshing ices. The chain has numerous other locations in the New York Metro, including a handful in other Staten Island neighborhoods. They are in New Dorp, Great Kills, Eltingville, Huguenot, and Pleasant Plains. The full list can be found here."
Bay House Bistro,"One of the best Asian take outs going. Focus on the appetizers, heavily influenced by Southeast Asian cuisine, particularly Malaysian. Try the roti canai or the curry veggie pies."
Taqueria Gallo Azteca,"The cemitas are to die for, a sandwich with your choice of meat, with avocado, chipotle peppers, quesillo, and beans. One of the best sandwiches you'll ever have."
Burrito Bar,"Fun Tex-Mex restaurant with generous portions, bar is located on the lower level, and restaurant located upstairs."
Beso,New Spanish restaurant with live music occasionally. Tapas and sangria bring some much needed class to the neighborhood. A short walk from the ferry and a great place to eat.
Real Madrid,A restaurant with authentic Spanish food.
Spain Restaurant,A Spanish restaurant
